{
  "schemaVersion": 1,
  "id": "vue-components/scroll-observer",
  "title": "Scroll Observer",
  "description": "The QScrollObserver Vue component emits an event whenever the user scrolls the page or the parent scrollable container.",
  "canonicalUrl": "https://quasar.dev/vue-components/scroll-observer",
  "source": "docs/src/pages/vue-components/scroll-observer.md",
  "sourceCommit": "306b70ecbb2e9271a3eb4aeda3292e0700a7e723",
  "products": {
    "quasar": "2.21.4"
  },
  "area": "vue-components",
  "kinds": [
    "component"
  ],
  "apiReferences": [
    "QScrollObserver"
  ],
  "examples": [
    {
      "title": "Basic",
      "file": "Basic.vue",
      "source": "docs/src/examples/QScrollObserver/Basic.vue"
    }
  ]
}
