{
  "schemaVersion": 1,
  "id": "quasar-cli-vite/developing-pwa/preparation",
  "title": "Preparation for PWA",
  "description": "(@quasar/app-vite) How to add PWA mode with Quasar CLI.",
  "canonicalUrl": "https://quasar.dev/quasar-cli-vite/developing-pwa/preparation",
  "source": "docs/src/pages/quasar-cli-vite/developing-pwa/preparation.md",
  "sourceCommit": "ce0a48fd6b630899d16203816e32c7d11afcb4be",
  "products": {
    "quasar": "2.21.4"
  },
  "area": "quasar-cli-vite/pwa",
  "kinds": ["guide"],
  "apiReferences": [],
  "examples": []
}
