{
  "schemaVersion": 1,
  "id": "options/global-node",
  "title": "Global node generation",
  "description": "Some Quasar components and plugins to show floating elements will create global nodes appending them to the body.",
  "canonicalUrl": "https://quasar.dev/options/global-node",
  "source": "docs/src/pages/options/global-node.md",
  "sourceCommit": "306b70ecbb2e9271a3eb4aeda3292e0700a7e723",
  "products": {
    "quasar": "2.21.4"
  },
  "area": "options",
  "kinds": [
    "guide"
  ],
  "apiReferences": [],
  "examples": []
}
