{
  "schemaVersion": 1,
  "id": "quasar-cli-vite/developing-electron-apps/installing-electron-dependencies",
  "title": "Installing Electron-specific dependencies",
  "description": "(@quasar/app-vite) How to handle Electron-specific dependencies.",
  "canonicalUrl": "https://quasar.dev/quasar-cli-vite/developing-electron-apps/installing-electron-dependencies",
  "source": "docs/src/pages/quasar-cli-vite/developing-electron-apps/installing-electron-dependencies.md",
  "sourceCommit": "306b70ecbb2e9271a3eb4aeda3292e0700a7e723",
  "products": {
    "quasar": "2.21.4"
  },
  "area": "quasar-cli-vite/electron-apps",
  "kinds": [
    "guide"
  ],
  "apiReferences": [],
  "examples": []
}
