{
  "schemaVersion": 1,
  "id": "quasar-cli-vite/developing-ssr/ssr-with-pwa",
  "title": "SSR with PWA Client Takeover",
  "description": "(@quasar/app-vite) How to configure your Quasar server-side rendered app to become a Progressive Web App on the client side.",
  "canonicalUrl": "https://quasar.dev/quasar-cli-vite/developing-ssr/ssr-with-pwa",
  "source": "docs/src/pages/quasar-cli-vite/developing-ssr/ssr-with-pwa.md",
  "sourceCommit": "ce0a48fd6b630899d16203816e32c7d11afcb4be",
  "products": {
    "quasar": "2.21.4"
  },
  "area": "quasar-cli-vite/ssr",
  "kinds": ["guide"],
  "apiReferences": [],
  "examples": []
}
