{
  "schemaVersion": 1,
  "id": "quasar-cli-vite/developing-ssr/installing-ssr-dependencies",
  "title": "Installing SSR-specific dependencies",
  "description": "(@quasar/app-vite) How to handle SSR-specific dependencies.",
  "canonicalUrl": "https://quasar.dev/quasar-cli-vite/developing-ssr/installing-ssr-dependencies",
  "source": "docs/src/pages/quasar-cli-vite/developing-ssr/installing-ssr-dependencies.md",
  "sourceCommit": "ce0a48fd6b630899d16203816e32c7d11afcb4be",
  "products": {
    "quasar": "2.21.4"
  },
  "area": "quasar-cli-vite/ssr",
  "kinds": ["guide"],
  "apiReferences": [],
  "examples": []
}
