{
  "schemaVersion": 1,
  "id": "quasar-cli-vite/boot-files",
  "title": "Boot files",
  "description": "(@quasar/app-vite) Managing your startup code in a Quasar app.",
  "canonicalUrl": "https://quasar.dev/quasar-cli-vite/boot-files",
  "source": "docs/src/pages/quasar-cli-vite/boot-files.md",
  "sourceCommit": "ce0a48fd6b630899d16203816e32c7d11afcb4be",
  "products": {
    "quasar": "2.21.4"
  },
  "area": "quasar-cli-vite",
  "kinds": ["guide"],
  "apiReferences": [],
  "examples": []
}
