{
  "schemaVersion": 1,
  "id": "vue-directives/material-ripples",
  "title": "Material Ripples",
  "description": "Vue directive for easily adding material ripples to your components and DOM elements.",
  "canonicalUrl": "https://quasar.dev/vue-directives/material-ripples",
  "source": "docs/src/pages/vue-directives/material-ripples.md",
  "sourceCommit": "ce0a48fd6b630899d16203816e32c7d11afcb4be",
  "products": {
    "quasar": "2.21.4"
  },
  "area": "vue-directives",
  "kinds": ["directive"],
  "apiReferences": ["Ripple"],
  "examples": [
    {
      "title": "Basic",
      "file": "Basic.vue",
      "source": "docs/src/examples/Ripple/Basic.vue"
    },
    {
      "title": "Colored",
      "file": "Colored.vue",
      "source": "docs/src/examples/Ripple/Colored.vue"
    },
    {
      "title": "Positioning",
      "file": "Positioning.vue",
      "source": "docs/src/examples/Ripple/Positioning.vue"
    },
    {
      "title": "Triggering immediately",
      "file": "Early.vue",
      "source": "docs/src/examples/Ripple/Early.vue"
    },
    {
      "title": "Disable",
      "file": "Disable.vue",
      "source": "docs/src/examples/Ripple/Disable.vue"
    }
  ]
}
