{
  "schemaVersion": 1,
  "id": "quasar-cli-vite/developing-ssr/hybrid-ssr-with-partial-csr",
  "title": "Hybrid SSR with partial CSR",
  "description": "(@quasar/app-vite) How to handle a hybrid SSR with partial CSR with Quasar CLI.",
  "canonicalUrl": "https://quasar.dev/quasar-cli-vite/developing-ssr/hybrid-ssr-with-partial-csr",
  "source": "docs/src/pages/quasar-cli-vite/developing-ssr/hybrid-ssr-with-partial-csr.md",
  "sourceCommit": "ce0a48fd6b630899d16203816e32c7d11afcb4be",
  "products": {
    "quasar": "2.21.4"
  },
  "area": "quasar-cli-vite/ssr",
  "kinds": ["guide"],
  "apiReferences": [],
  "examples": []
}
