{
  "schemaVersion": 1,
  "id": "quasar-cli-vite/developing-ssg/installing-ssg-dependencies",
  "title": "Installing SSG-specific dependencies",
  "description": "(@quasar/app-vite) How to handle SSG-specific dependencies.",
  "canonicalUrl": "https://quasar.dev/quasar-cli-vite/developing-ssg/installing-ssg-dependencies",
  "source": "docs/src/pages/quasar-cli-vite/developing-ssg/installing-ssg-dependencies.md",
  "sourceCommit": "ce0a48fd6b630899d16203816e32c7d11afcb4be",
  "products": {
    "quasar": "2.21.4"
  },
  "area": "quasar-cli-vite/ssg",
  "kinds": ["guide"],
  "apiReferences": [],
  "examples": []
}
