{
  "schemaVersion": 1,
  "id": "layout/drawer",
  "title": "Layout Drawer",
  "description": "How to use the QDrawer component. The sidebars of your Quasar app.",
  "canonicalUrl": "https://quasar.dev/layout/drawer",
  "source": "docs/src/pages/layout/drawer.md",
  "sourceCommit": "306b70ecbb2e9271a3eb4aeda3292e0700a7e723",
  "products": {
    "quasar": "2.21.4"
  },
  "area": "layout",
  "kinds": [
    "component"
  ],
  "apiReferences": [
    "QDrawer"
  ],
  "examples": [
    {
      "title": "Basic",
      "file": "Basic.vue",
      "source": "docs/src/examples/QDrawer/Basic.vue"
    },
    {
      "title": "With navigation menu",
      "file": "Menu.vue",
      "source": "docs/src/examples/QDrawer/Menu.vue"
    },
    {
      "title": "Seamless menu",
      "file": "MenuSeamless.vue",
      "source": "docs/src/examples/QDrawer/MenuSeamless.vue"
    },
    {
      "title": "Header Picture",
      "file": "HeaderPicture.vue",
      "source": "docs/src/examples/QDrawer/HeaderPicture.vue"
    },
    {
      "title": "Mini-mode with mouseover/mouseout trigger",
      "file": "MiniMouseEvents.vue",
      "source": "docs/src/examples/QDrawer/MiniMouseEvents.vue"
    },
    {
      "title": "Mini to overlay",
      "file": "MiniToOverlay.vue",
      "source": "docs/src/examples/QDrawer/MiniToOverlay.vue"
    },
    {
      "title": "Mini-mode with click trigger",
      "file": "MiniClickEvent.vue",
      "source": "docs/src/examples/QDrawer/MiniClickEvent.vue"
    },
    {
      "title": "Mini-mode with slot",
      "file": "MiniSlot.vue",
      "source": "docs/src/examples/QDrawer/MiniSlot.vue"
    },
    {
      "title": "Overlay mode",
      "file": "OverlayMode.vue",
      "source": "docs/src/examples/QDrawer/OverlayMode.vue"
    }
  ]
}
