{
  "schemaVersion": 1,
  "id": "quasar-cli-vite/quasar-config-file",
  "title": "Configuring quasar.config file",
  "description": "(@quasar/app-vite) Where, how and what you can configure in a Quasar CLI with Vite app.",
  "canonicalUrl": "https://quasar.dev/quasar-cli-vite/quasar-config-file",
  "source": "docs/src/pages/quasar-cli-vite/quasar-config-file.md",
  "sourceCommit": "ce0a48fd6b630899d16203816e32c7d11afcb4be",
  "products": {
    "quasar": "2.21.4"
  },
  "area": "quasar-cli-vite",
  "kinds": ["guide"],
  "apiReferences": [],
  "examples": []
}
