{
  "schemaVersion": 1,
  "id": "quasar-utils/other-utils",
  "title": "Other Utils",
  "description": "A set of miscellaneous Quasar methods for debouncing or throttling functions, deep copying objects, cross-platform URL opening or handling DOM events.",
  "canonicalUrl": "https://quasar.dev/quasar-utils/other-utils",
  "source": "docs/src/pages/quasar-utils/other-utils.md",
  "sourceCommit": "ce0a48fd6b630899d16203816e32c7d11afcb4be",
  "products": {
    "quasar": "2.21.4"
  },
  "area": "quasar-utils",
  "kinds": ["guide"],
  "apiReferences": [],
  "examples": []
}
