{
  "schemaVersion": 1,
  "id": "quasar-cli-vite/directory-structure",
  "title": "Directory Structure",
  "description": "(@quasar/app-vite) The structure of a Quasar app with explanations for each folder and file.",
  "canonicalUrl": "https://quasar.dev/quasar-cli-vite/directory-structure",
  "source": "docs/src/pages/quasar-cli-vite/directory-structure.md",
  "sourceCommit": "306b70ecbb2e9271a3eb4aeda3292e0700a7e723",
  "products": {
    "quasar": "2.21.4"
  },
  "area": "quasar-cli-vite",
  "kinds": [
    "guide"
  ],
  "apiReferences": [],
  "examples": []
}
