{
  "schemaVersion": 1,
  "id": "quasar-cli-vite/developing-electron-apps/electron-with-typescript",
  "title": "Electron with TypeScript",
  "description": "(@quasar/app-vite) How to use TypeScript with Electron in Quasar",
  "canonicalUrl": "https://quasar.dev/quasar-cli-vite/developing-electron-apps/electron-with-typescript",
  "source": "docs/src/pages/quasar-cli-vite/developing-electron-apps/electron-with-typescript.md",
  "sourceCommit": "ce0a48fd6b630899d16203816e32c7d11afcb4be",
  "products": {
    "quasar": "2.21.4"
  },
  "area": "quasar-cli-vite/electron-apps",
  "kinds": ["guide"],
  "apiReferences": [],
  "examples": []
}
