{
  "schemaVersion": 1,
  "id": "options/quasar-icon-sets",
  "title": "Quasar Icon Sets",
  "description": "How to configure icon sets for Quasar components.",
  "canonicalUrl": "https://quasar.dev/options/quasar-icon-sets",
  "source": "docs/src/pages/options/quasar-icon-sets.md",
  "sourceCommit": "ce0a48fd6b630899d16203816e32c7d11afcb4be",
  "products": {
    "quasar": "2.21.4"
  },
  "area": "options",
  "kinds": ["plugin"],
  "apiReferences": ["IconSet"],
  "examples": []
}
