{
  "schemaVersion": 1,
  "id": "quasar-cli-vite/developing-electron-apps/troubleshooting-and-tips",
  "title": "Troubleshooting and Tips",
  "description": "(@quasar/app-vite) Troubleshooting a Quasar desktop app with Electron.",
  "canonicalUrl": "https://quasar.dev/quasar-cli-vite/developing-electron-apps/troubleshooting-and-tips",
  "source": "docs/src/pages/quasar-cli-vite/developing-electron-apps/troubleshooting-and-tips.md",
  "sourceCommit": "ce0a48fd6b630899d16203816e32c7d11afcb4be",
  "products": {
    "quasar": "2.21.4"
  },
  "area": "quasar-cli-vite/electron-apps",
  "kinds": ["guide"],
  "apiReferences": [],
  "examples": []
}
