{
  "schemaVersion": 1,
  "id": "quasar-cli-vite/developing-cordova-apps/preparation",
  "title": "Preparation for Cordova App",
  "description": "(@quasar/app-vite) What you need before developing a Quasar hybrid mobile app with Cordova.",
  "canonicalUrl": "https://quasar.dev/quasar-cli-vite/developing-cordova-apps/preparation",
  "source": "docs/src/pages/quasar-cli-vite/developing-cordova-apps/preparation.md",
  "sourceCommit": "306b70ecbb2e9271a3eb4aeda3292e0700a7e723",
  "products": {
    "quasar": "2.21.4"
  },
  "area": "quasar-cli-vite/cordova-apps",
  "kinds": [
    "guide"
  ],
  "apiReferences": [],
  "examples": []
}
