{
  "schemaVersion": 1,
  "id": "quasar-cli-vite/developing-cordova-apps/managing-google-analytics",
  "title": "Managing Google Analytics",
  "description": "(@quasar/app-vite) How to plan analytics integration in a Quasar Cordova app.",
  "canonicalUrl": "https://quasar.dev/quasar-cli-vite/developing-cordova-apps/managing-google-analytics",
  "source": "docs/src/pages/quasar-cli-vite/developing-cordova-apps/managing-google-analytics.md",
  "sourceCommit": "306b70ecbb2e9271a3eb4aeda3292e0700a7e723",
  "products": {
    "quasar": "2.21.4"
  },
  "area": "quasar-cli-vite/cordova-apps",
  "kinds": [
    "guide"
  ],
  "apiReferences": [],
  "examples": []
}
